{
  "$schema": "https://json-schema.org/draft/2020-12/schema",
  "$id": "player_prediction_response/1",
  "title": "player_prediction_response/1",
  "description": "Model-agnostic versioned prediction response. Structural shape only. The cross-field invariants I4/I5/I6/I8/I9 -- degraded input forces a withheld projection, a withheld projection carries no number and a blocking warning, a served projection carries a finite point and complete uncertainty, the audit digest recomputes, an unavailable market carries no number -- are NOT expressible here and are enforced by validate_response() in prediction_response_schema.py. Passing this JSON Schema is necessary and NOT sufficient.",
  "x_epistemic_status": "PRODUCT SCAFFOLD built against fixtures. Carries no scientific claim and must not imply a model has been promoted.",
  "type": "object",
  "additionalProperties": false,
  "required": ["schema", "schema_version", "response_id", "generated_at_utc", "game", "model", "inputs", "projections", "warnings", "audit"],
  "properties": {
    "schema": {"const": "player_prediction_response/1"},
    "schema_version": {"type": "string", "pattern": "^\\d+\\.\\d+\\.\\d+$"},
    "response_id": {"type": "string", "minLength": 1},
    "generated_at_utc": {"$ref": "#/$defs/utc"},
    "game": {
      "type": "object",
      "additionalProperties": false,
      "required": ["game_id", "game_cluster_id", "season", "home_team_id", "away_team_id", "scheduled_tip_utc", "forecast_cutoff_utc"],
      "properties": {
        "game_id": {"type": "string", "minLength": 1},
        "game_cluster_id": {"type": "string", "minLength": 1},
        "season": {"type": "integer"},
        "home_team_id": {"type": "string", "minLength": 1},
        "away_team_id": {"type": "string", "minLength": 1},
        "scheduled_tip_utc": {"oneOf": [{"$ref": "#/$defs/utc"}, {"type": "null"}]},
        "forecast_cutoff_utc": {"$ref": "#/$defs/utc"}
      }
    },
    "model": {
      "type": "object",
      "description": "Opaque model identity. No consumer of this schema may branch on model_version or model_family.",
      "additionalProperties": false,
      "required": ["model_version", "model_family", "artifact_sha256", "promotion_status", "control_pairing", "registry_record", "produced_by"],
      "properties": {
        "model_version": {"type": "string", "minLength": 1},
        "model_family": {"type": "string", "minLength": 1},
        "artifact_sha256": {
          "type": "object",
          "minProperties": 1,
          "additionalProperties": {"$ref": "#/$defs/sha256"}
        },
        "promotion_status": {"enum": ["no_challenger_promoted", "promoted_by_registered_decision"]},
        "control_pairing": {"type": ["string", "null"]},
        "registry_record": {"type": ["string", "null"]},
        "produced_by": {"type": ["string", "null"]}
      }
    },
    "inputs": {
      "type": "array",
      "minItems": 1,
      "items": {
        "type": "object",
        "additionalProperties": false,
        "required": ["input_id", "source", "sha256", "as_of_utc", "observed_at_utc", "age_seconds", "max_age_seconds", "job_status", "freshness", "degraded"],
        "properties": {
          "input_id": {"type": "string", "minLength": 1},
          "source": {"type": "string"},
          "sha256": {"oneOf": [{"$ref": "#/$defs/sha256"}, {"type": "null"}]},
          "as_of_utc": {"oneOf": [{"$ref": "#/$defs/utc"}, {"type": "null"}]},
          "observed_at_utc": {"oneOf": [{"$ref": "#/$defs/utc"}, {"type": "null"}]},
          "age_seconds": {"type": ["number", "null"]},
          "max_age_seconds": {"type": ["number", "null"]},
          "job_status": {"enum": ["ok", "failed", "not_run"]},
          "freshness": {"enum": ["fresh", "stale", "missing"]},
          "degraded": {"type": "boolean"}
        }
      }
    },
    "projections": {
      "type": "array",
      "items": {
        "type": "object",
        "additionalProperties": false,
        "required": ["projection_id", "subject_type", "subject_id", "team_id", "target", "unit", "status", "withheld_reasons", "point", "uncertainty", "components", "depends_on", "market"],
        "properties": {
          "projection_id": {"type": "string", "minLength": 1},
          "subject_type": {"enum": ["player", "team"]},
          "subject_id": {"type": "string", "minLength": 1},
          "team_id": {"type": "string", "minLength": 1},
          "target": {"type": "string", "minLength": 1},
          "unit": {"type": "string", "minLength": 1},
          "status": {"enum": ["served", "withheld"]},
          "withheld_reasons": {"type": "array", "items": {"type": "string"}},
          "point": {"type": ["number", "null"]},
          "uncertainty": {
            "type": "object",
            "additionalProperties": false,
            "required": ["sd", "p10", "p50", "p90"],
            "properties": {
              "sd": {"type": ["number", "null"]},
              "p10": {"type": ["number", "null"]},
              "p50": {"type": ["number", "null"]},
              "p90": {"type": ["number", "null"]}
            }
          },
          "components": {
            "type": "array",
            "items": {
              "type": "object",
              "additionalProperties": false,
              "required": ["name", "basis", "unit", "contribution"],
              "properties": {
                "name": {"type": "string", "minLength": 1},
                "basis": {"type": "string", "minLength": 1},
                "unit": {"type": "string"},
                "contribution": {"type": ["number", "null"]}
              }
            }
          },
          "depends_on": {"type": "array", "items": {"type": "string"}},
          "market": {
            "type": "object",
            "additionalProperties": false,
            "required": ["available", "book", "line", "over_price", "under_price", "captured_at_utc", "unavailable_reason", "edge_vs_line"],
            "properties": {
              "available": {"type": "boolean"},
              "book": {"type": ["string", "null"]},
              "line": {"type": ["number", "null"]},
              "over_price": {"type": ["integer", "null"]},
              "under_price": {"type": ["integer", "null"]},
              "captured_at_utc": {"oneOf": [{"$ref": "#/$defs/utc"}, {"type": "null"}]},
              "unavailable_reason": {"type": ["string", "null"]},
              "edge_vs_line": {"type": ["number", "null"]}
            }
          }
        }
      }
    },
    "warnings": {
      "type": "array",
      "items": {
        "type": "object",
        "additionalProperties": false,
        "required": ["code", "severity", "message", "scope"],
        "properties": {
          "code": {"type": "string", "minLength": 1},
          "severity": {"enum": ["blocking", "advisory"]},
          "message": {"type": "string", "minLength": 1},
          "scope": {"type": "string", "minLength": 1}
        }
      }
    },
    "audit": {
      "type": "object",
      "additionalProperties": false,
      "required": ["schema", "schema_version", "node_id", "code_version", "fixture_mode", "epistemic_status", "inputs_digest", "request_echo", "n_projections_served", "n_projections_withheld", "n_blocking_warnings"],
      "properties": {
        "schema": {"const": "player_prediction_response/1"},
        "schema_version": {"type": "string"},
        "node_id": {"type": "string"},
        "code_version": {"type": "string"},
        "fixture_mode": {"type": "boolean"},
        "epistemic_status": {"type": "string"},
        "inputs_digest": {"$ref": "#/$defs/sha256"},
        "request_echo": {"type": "object"},
        "n_projections_served": {"type": "integer", "minimum": 0},
        "n_projections_withheld": {"type": "integer", "minimum": 0},
        "n_blocking_warnings": {"type": "integer", "minimum": 0}
      }
    }
  },
  "$defs": {
    "sha256": {"type": "string", "pattern": "^[0-9a-f]{64}$"},
    "utc": {"type": "string", "pattern": "^\\d{4}-\\d{2}-\\d{2}T\\d{2}:\\d{2}:\\d{2}(\\.\\d+)?Z$"}
  }
}
